root@lamp-ubuntu-s-1vcpu-1gb-tor1-01:~# tcpdump -n -i eth0
tcpdump: verbose output suppressed, use -v[v]... for full protocol decode
listening on eth0, link-type EN10MB (Ethernet), snapshot length 262144 bytes
22:07:12.532351 IP 159.203.38.32.22 > 199.68.126.110.58068: Flags [P.], seq 1634645761:1634645869, ack 3950300948, win 544, length 108
22:07:12.532473 IP 159.203.38.32.22 > 199.68.126.110.58068: Flags [P.], seq 108:224, ack 1, win 544, length 116
22:07:12.535026 IP 199.68.126.110.58068 > 159.203.38.32.22: Flags [.], ack 224, win 3566, length 0
22:07:12.555469 IP 199.68.126.110.58068 > 159.203.38.32.22: Flags [P.], seq 1:37, ack 224, win 3566, length 36
22:07:12.555633 IP 159.203.38.32.22 > 199.68.126.110.58068: Flags [P.], seq 224:260, ack 37, win 544, length 36
22:07:12.586476 IP 199.68.126.110.58068 > 159.203.38.32.22: Flags [P.], seq 37:73, ack 260, win 3566, length 36
22:07:12.586647 IP 159.203.38.32.22 > 199.68.126.110.58068: Flags [P.], seq 260:296, ack 73, win 544, length 36
22:07:12.617372 IP 199.68.126.110.58068 > 159.203.38.32.22: Flags [P.], seq 73:109, ack 296, win 3566, length 36
22:07:12.617547 IP 159.203.38.32.22 > 199.68.126.110.58068: Flags [P.], seq 296:332, ack 109, win 544, length 36
22:07:12.636623 IP 159.203.38.32.22 > 199.68.126.110.58068: Flags [P.], seq 332:1400, ack 109, win 544, length 1068
22:07:12.640457 IP 199.68.126.110.58068 > 159.203.38.32.22: Flags [.], ack 1400, win 3570, length 0
22:07:12.640563 IP 199.68.126.110.58068 > 159.203.38.32.22: Flags [P.], seq 109:145, ack 1400, win 3570, length 36
22:07:12.640661 IP 159.203.38.32.22 > 199.68.126.110.58068: Flags [P.], seq 1400:1436, ack 145, win 544, length 36
22:07:12.665458 IP 199.68.126.110.58068 > 159.203.38.32.22: Flags [P.], seq 145:181, ack 1436, win 3570, length 36
22:07:12.665617 IP 159.203.38.32.22 > 199.68.126.110.58068: Flags [P.], seq 1436:1472, ack 181, win 544, length 36
22:07:12.696474 IP 199.68.126.110.58068 > 159.203.38.32.22: Flags [P.], seq 181:217, ack 1472, win 3569, length 36
22:07:12.696635 IP 159.203.38.32.22 > 199.68.126.110.58068: Flags [P.], seq 1472:1508, ack 217, win 544, length 36
22:07:12.728460 IP 199.68.126.110.58068 > 159.203.38.32.22: Flags [P.], seq 217:253, ack 1508, win 3569, length 36
22:07:12.728633 IP 159.203.38.32.22 > 199.68.126.110.58068: Flags [P.], seq 1508:1544, ack 253, win 544, length 36
22:07:12.740399 IP 159.203.38.32.22 > 199.68.126.110.58068: Flags [P.], seq 1544:1700, ack 253, win 544, length 156
22:07:12.740636 IP 159.203.38.32.22 > 199.68.126.110.58068: Flags [P.], seq 1700:2768, ack 253, win 544, length 1068
22:07:12.744621 IP 199.68.126.110.58068 > 159.203.38.32.22: Flags [.], ack 1700, win 3568, length 0
22:07:12.759469 IP 199.68.126.110.58068 > 159.203.38.32.22: Flags [P.], seq 253:289, ack 2768, win 3564, length 36
22:07:12.759646 IP 159.203.38.32.22 > 199.68.126.110.58068: Flags [P.], seq 2768:2804, ack 289, win 544, length 36
22:07:12.788772 IP 199.68.126.110.58068 > 159.203.38.32.22: Flags [P.], seq 289:325, ack 2804, win 3564, length 36
22:07:12.788941 IP 159.203.38.32.22 > 199.68.126.110.58068: Flags [P.], seq 2804:2840, ack 325, win 544, length 36
22:07:12.821486 IP 199.68.126.110.58068 > 159.203.38.32.22: Flags [P.], seq 325:361, ack 2840, win 3564, length 36
22:07:12.821671 IP 159.203.38.32.22 > 199.68.126.110.58068: Flags [P.], seq 2840:2876, ack 361, win 544, length 36
22:07:12.844540 IP 159.203.38.32.22 > 199.68.126.110.58068: Flags [P.], seq 2876:3944, ack 361, win 544, length 1068
22:07:12.848473 IP 199.68.126.110.58068 > 159.203.38.32.22: Flags [.], ack 3944, win 3570, length 0
22:07:12.848569 IP 199.68.126.110.58068 > 159.203.38.32.22: Flags [P.], seq 361:397, ack 3944, win 3570, length 36
22:07:12.848690 IP 159.203.38.32.22 > 199.68.126.110.58068: Flags [P.], seq 3944:3980, ack 397, win 544, length 36
22:07:12.883491 IP 199.68.126.110.58068 > 159.203.38.32.22: Flags [P.], seq 397:433, ack 3980, win 3570, length 36
22:07:12.883705 IP 159.203.38.32.22 > 199.68.126.110.58068: Flags [P.], seq 3980:4016, ack 433, win 544, length 36
22:07:12.914492 IP 199.68.126.110.58068 > 159.203.38.32.22: Flags [P.], seq 433:469, ack 4016, win 3569, length 36
22:07:12.914697 IP 159.203.38.32.22 > 199.68.126.110.58068: Flags [P.], seq 4016:4052, ack 469, win 544, length 36
22:07:12.946485 IP 199.68.126.110.58068 > 159.203.38.32.22: Flags [P.], seq 469:505, ack 4052, win 3569, length 36
22:07:12.946650 IP 159.203.38.32.22 > 199.68.126.110.58068: Flags [P.], seq 4052:4088, ack 505, win 544, length 36
22:07:12.948388 IP 159.203.38.32.22 > 199.68.126.110.58068: Flags [P.], seq 4088:4244, ack 505, win 544, length 156
22:07:12.948581 IP 159.203.38.32.22 > 199.68.126.110.58068: Flags [P.], seq 4244:5192, ack 505, win 544, length 948
22:07:12.948647 IP 159.203.38.32.22 > 199.68.126.110.58068: Flags [P.], seq 5192:5348, ack 505, win 544, length 156
22:07:12.950988 IP 199.68.126.110.58068 > 159.203.38.32.22: Flags [.], ack 4244, win 3568, length 0
22:07:12.951307 IP 199.68.126.110.58068 > 159.203.38.32.22: Flags [.], ack 5348, win 3564, length 0
22:07:12.977498 IP 199.68.126.110.58068 > 159.203.38.32.22: Flags [P.], seq 505:541, ack 5348, win 3564, length 36
22:07:12.977725 IP 159.203.38.32.22 > 199.68.126.110.58068: Flags [P.], seq 5348:5384, ack 541, win 544, length 36
22:07:13.007470 IP 199.68.126.110.58068 > 159.203.38.32.22: Flags [P.], seq 541:577, ack 5384, win 3564, length 36
22:07:13.007646 IP 159.203.38.32.22 > 199.68.126.110.58068: Flags [P.], seq 5384:5420, ack 577, win 544, length 36
22:07:13.038453 IP 199.68.126.110.58068 > 159.203.38.32.22: Flags [P.], seq 577:613, ack 5420, win 3570, length 36
22:07:13.038678 IP 159.203.38.32.22 > 199.68.126.110.58068: Flags [P.], seq 5420:5456, ack 613, win 544, length 36
22:07:13.052554 IP 159.203.38.32.22 > 199.68.126.110.58068: Flags [P.], seq 5456:6740, ack 613, win 544, length 1284
22:07:13.056470 IP 199.68.126.110.58068 > 159.203.38.32.22: Flags [.], ack 6740, win 3565, length 0
22:07:13.071474 IP 199.68.126.110.58068 > 159.203.38.32.22: Flags [P.], seq 613:649, ack 6740, win 3565, length 36
22:07:13.071654 IP 159.203.38.32.22 > 199.68.126.110.58068: Flags [P.], seq 6740:6776, ack 649, win 544, length 36
22:07:13.102469 IP 199.68.126.110.58068 > 159.203.38.32.22: Flags [P.], seq 649:685, ack 6776, win 3564, length 36
22:07:13.102656 IP 159.203.38.32.22 > 199.68.126.110.58068: Flags [P.], seq 6776:6812, ack 685, win 544, length 36
22:07:13.132810 IP 199.68.126.110.58068 > 159.203.38.32.22: Flags [P.], seq 685:721, ack 6812, win 3564, length 36
22:07:13.132989 IP 159.203.38.32.22 > 199.68.126.110.58068: Flags [P.], seq 6812:6848, ack 721, win 544, length 36
22:07:13.156468 IP 159.203.38.32.22 > 199.68.126.110.58068: Flags [P.], seq 6848:7004, ack 721, win 544, length 156
22:07:13.156702 IP 159.203.38.32.22 > 199.68.126.110.58068: Flags [P.], seq 7004:7840, ack 721, win 544, length 836
22:07:13.159617 IP 199.68.126.110.58068 > 159.203.38.32.22: Flags [.], ack 7004, win 3570, length 0
22:07:13.159617 IP 199.68.126.110.58068 > 159.203.38.32.22: Flags [P.], seq 721:757, ack 7004, win 3570, length 36
22:07:13.159761 IP 159.203.38.32.22 > 199.68.126.110.58068: Flags [P.], seq 7840:7876, ack 757, win 544, length 36
22:07:13.162368 IP 199.68.126.110.58068 > 159.203.38.32.22: Flags [.], ack 7876, win 3566, length 0
22:07:13.196492 IP 199.68.126.110.58068 > 159.203.38.32.22: Flags [P.], seq 757:793, ack 7876, win 3566, length 36
22:07:13.196691 IP 159.203.38.32.22 > 199.68.126.110.58068: Flags [P.], seq 7876:7912, ack 793, win 544, length 36
22:07:13.227495 IP 199.68.126.110.58068 > 159.203.38.32.22: Flags [P.], seq 793:829, ack 7912, win 3566, length 36
22:07:13.227684 IP 159.203.38.32.22 > 199.68.126.110.58068: Flags [P.], seq 7912:7948, ack 829, win 544, length 36
22:07:13.259481 IP 199.68.126.110.58068 > 159.203.38.32.22: Flags [P.], seq 829:865, ack 7948, win 3566, length 36
22:07:13.259673 IP 159.203.38.32.22 > 199.68.126.110.58068: Flags [P.], seq 7948:7984, ack 865, win 544, length 36
22:07:13.260431 IP 159.203.38.32.22 > 199.68.126.110.58068: Flags [P.], seq 7984:9388, ack 865, win 544, length 1404
22:07:13.263177 IP 199.68.126.110.58068 > 159.203.38.32.22: Flags [.], ack 9388, win 3570, length 0
22:07:13.290536 IP 199.68.126.110.58068 > 159.203.38.32.22: Flags [P.], seq 865:901, ack 9388, win 3570, length 36
22:07:13.290719 IP 159.203.38.32.22 > 199.68.126.110.58068: Flags [P.], seq 9388:9424, ack 901, win 544, length 36
22:07:13.319506 IP 199.68.126.110.58068 > 159.203.38.32.22: Flags [P.], seq 901:937, ack 9424, win 3570, length 36
22:07:13.319671 IP 159.203.38.32.22 > 199.68.126.110.58068: Flags [P.], seq 9424:9460, ack 937, win 544, length 36
22:07:13.351514 IP 199.68.126.110.58068 > 159.203.38.32.22: Flags [P.], seq 937:973, ack 9460, win 3569, length 36
22:07:13.351710 IP 159.203.38.32.22 > 199.68.126.110.58068: Flags [P.], seq 9460:9496, ack 973, win 544, length 36
22:07:13.364462 IP 159.203.38.32.22 > 199.68.126.110.58068: Flags [P.], seq 9496:9652, ack 973, win 544, length 156
22:07:13.364666 IP 159.203.38.32.22 > 199.68.126.110.58068: Flags [P.], seq 9652:10488, ack 973, win 544, length 836
22:07:13.368483 IP 199.68.126.110.58068 > 159.203.38.32.22: Flags [.], ack 9652, win 3569, length 0
22:07:13.381491 IP 199.68.126.110.58068 > 159.203.38.32.22: Flags [P.], seq 973:1009, ack 10488, win 3565, length 36
22:07:13.381664 IP 159.203.38.32.22 > 199.68.126.110.58068: Flags [P.], seq 10488:10524, ack 1009, win 544, length 36
22:07:13.413515 IP 199.68.126.110.58068 > 159.203.38.32.22: Flags [P.], seq 1009:1045, ack 10524, win 3565, length 36
22:07:13.413682 IP 159.203.38.32.22 > 199.68.126.110.58068: Flags [P.], seq 10524:10560, ack 1045, win 544, length 36
22:07:13.444452 IP 199.68.126.110.58068 > 159.203.38.32.22: Flags [P.], seq 1045:1081, ack 10560, win 3565, length 36
22:07:13.444604 IP 159.203.38.32.22 > 199.68.126.110.58068: Flags [P.], seq 10560:10596, ack 1081, win 544, length 36
22:07:13.468491 IP 159.203.38.32.22 > 199.68.126.110.58068: Flags [P.], seq 10596:11680, ack 1081, win 544, length 1084
22:07:13.472473 IP 199.68.126.110.58068 > 159.203.38.32.22: Flags [.], ack 11680, win 3570, length 0
22:07:13.472542 IP 199.68.126.110.58068 > 159.203.38.32.22: Flags [P.], seq 1081:1117, ack 11680, win 3570, length 36
22:07:13.472649 IP 159.203.38.32.22 > 199.68.126.110.58068: Flags [P.], seq 11680:11716, ack 1117, win 544, length 36
22:07:13.494609 IP 45.215.247.70.51988 > 159.203.38.32.27015: UDP, length 25
22:07:13.505810 IP 199.68.126.110.58068 > 159.203.38.32.22: Flags [P.], seq 1117:1153, ack 11716, win 3570, length 36
22:07:13.506048 IP 159.203.38.32.22 > 199.68.126.110.58068: Flags [P.], seq 11716:11752, ack 1153, win 544, length 36
22:07:13.536327 IP 199.68.126.110.58068 > 159.203.38.32.22: Flags [P.], seq 1153:1189, ack 11752, win 3569, length 36
22:07:13.536528 IP 159.203.38.32.22 > 199.68.126.110.58068: Flags [P.], seq 11752:11788, ack 1189, win 544, length 36
22:07:13.567358 IP 199.68.126.110.58068 > 159.203.38.32.22: Flags [P.], seq 1189:1225, ack 11788, win 3569, length 36
22:07:13.567523 IP 159.203.38.32.22 > 199.68.126.110.58068: Flags [P.], seq 11788:11824, ack 1225, win 544, length 36
22:07:13.572460 IP 159.203.38.32.22 > 199.68.126.110.58068: Flags [P.], seq 11824:11980, ack 1225, win 544, length 156
22:07:13.572774 IP 159.203.38.32.22 > 199.68.126.110.58068: Flags [P.], seq 11980:13152, ack 1225, win 544, length 1172
22:07:13.575191 IP 199.68.126.110.58068 > 159.203.38.32.22: Flags [.], ack 11980, win 3568, length 0
22:07:13.598313 IP 199.68.126.110.58068 > 159.203.38.32.22: Flags [P.], seq 1225:1261, ack 13152, win 3570, length 36
22:07:13.598475 IP 159.203.38.32.22 > 199.68.126.110.58068: Flags [P.], seq 13152:13188, ack 1261, win 544, length 36
22:07:13.630491 IP 199.68.126.110.58068 > 159.203.38.32.22: Flags [P.], seq 1261:1297, ack 13188, win 3570, length 36
22:07:13.630668 IP 159.203.38.32.22 > 199.68.126.110.58068: Flags [P.], seq 13188:13224, ack 1297, win 544, length 36
22:07:13.661511 IP 199.68.126.110.58068 > 159.203.38.32.22: Flags [P.], seq 1297:1333, ack 13224, win 3569, length 36
22:07:13.661705 IP 159.203.38.32.22 > 199.68.126.110.58068: Flags [P.], seq 13224:13260, ack 1333, win 544, length 36
22:07:13.676720 IP 159.203.38.32.22 > 199.68.126.110.58068: Flags [P.], seq 13260:14352, ack 1333, win 544, length 1092
22:07:13.679483 IP 199.68.126.110.58068 > 159.203.38.32.22: Flags [.], ack 14352, win 3565, length 0
22:07:13.692485 IP 199.68.126.110.58068 > 159.203.38.32.22: Flags [P.], seq 1333:1369, ack 14352, win 3565, length 36
22:07:13.692649 IP 159.203.38.32.22 > 199.68.126.110.58068: Flags [P.], seq 14352:14388, ack 1369, win 544, length 36
22:07:13.723437 IP 199.68.126.110.58068 > 159.203.38.32.22: Flags [P.], seq 1369:1405, ack 14388, win 3565, length 36
22:07:13.723609 IP 159.203.38.32.22 > 199.68.126.110.58068: Flags [P.], seq 14388:14424, ack 1405, win 544, length 36
22:07:13.755508 IP 199.68.126.110.58068 > 159.203.38.32.22: Flags [P.], seq 1405:1441, ack 14424, win 3565, length 36
22:07:13.755714 IP 159.203.38.32.22 > 199.68.126.110.58068: Flags [P.], seq 14424:14460, ack 1441, win 544, length 36
22:07:13.780444 IP 159.203.38.32.22 > 199.68.126.110.58068: Flags [P.], seq 14460:14616, ack 1441, win 544, length 156
22:07:13.780638 IP 159.203.38.32.22 > 199.68.126.110.58068: Flags [P.], seq 14616:15468, ack 1441, win 544, length 852
22:07:13.784551 IP 199.68.126.110.58068 > 159.203.38.32.22: Flags [.], ack 14616, win 3570, length 0
22:07:13.784551 IP 199.68.126.110.58068 > 159.203.38.32.22: Flags [P.], seq 1441:1477, ack 14616, win 3570, length 36
22:07:13.784716 IP 159.203.38.32.22 > 199.68.126.110.58068: Flags [P.], seq 15468:15504, ack 1477, win 544, length 36
22:07:13.787341 IP 199.68.126.110.58068 > 159.203.38.32.22: Flags [.], ack 15504, win 3566, length 0
22:07:13.817499 IP 199.68.126.110.58068 > 159.203.38.32.22: Flags [P.], seq 1477:1513, ack 15504, win 3566, length 36
22:07:13.817669 IP 159.203.38.32.22 > 199.68.126.110.58068: Flags [P.], seq 15504:15540, ack 1513, win 544, length 36
22:07:13.865544 IP 199.68.126.110.58068 > 159.203.38.32.22: Flags [.], ack 15540, win 3566, length 0
22:07:13.884589 IP 159.203.38.32.22 > 199.68.126.110.58068: Flags [P.], seq 15540:16600, ack 1513, win 544, length 1060
22:07:13.943494 IP 199.68.126.110.58068 > 159.203.38.32.22: Flags [.], ack 16600, win 3570, length 0
22:07:13.988484 IP 159.203.38.32.22 > 199.68.126.110.58068: Flags [P.], seq 16600:16860, ack 1513, win 544, length 260
22:07:14.034560 IP 199.68.126.110.58068 > 159.203.38.32.22: Flags [.], ack 16860, win 3569, length 0
22:07:14.092492 IP 159.203.38.32.22 > 199.68.126.110.58068: Flags [P.], seq 16860:17120, ack 1513, win 544, length 260
22:07:14.146487 IP 199.68.126.110.58068 > 159.203.38.32.22: Flags [.], ack 17120, win 3568, length 0
22:07:14.196483 IP 159.203.38.32.22 > 199.68.126.110.58068: Flags [P.], seq 17120:17276, ack 1513, win 544, length 156
22:07:14.196644 IP 159.203.38.32.22 > 199.68.126.110.58068: Flags [P.], seq 17276:17416, ack 1513, win 544, length 140
22:07:14.199439 IP 199.68.126.110.58068 > 159.203.38.32.22: Flags [.], ack 17416, win 3566, length 0
22:07:14.300551 IP 159.203.38.32.22 > 199.68.126.110.58068: Flags [P.], seq 17416:17796, ack 1513, win 544, length 380
22:07:14.347470 IP 199.68.126.110.58068 > 159.203.38.32.22: Flags [.], ack 17796, win 3565, length 0
22:07:14.404522 IP 159.203.38.32.22 > 199.68.126.110.58068: Flags [P.], seq 17796:17952, ack 1513, win 544, length 156
22:07:14.404670 IP 159.203.38.32.22 > 199.68.126.110.58068: Flags [P.], seq 17952:18092, ack 1513, win 544, length 140
22:07:14.408495 IP 199.68.126.110.58068 > 159.203.38.32.22: Flags [.], ack 18092, win 3570, length 0
22:07:14.508518 IP 159.203.38.32.22 > 199.68.126.110.58068: Flags [P.], seq 18092:18472, ack 1513, win 544, length 380
22:07:14.565499 IP 199.68.126.110.58068 > 159.203.38.32.22: Flags [.], ack 18472, win 3568, length 0
22:07:14.612467 IP 159.203.38.32.22 > 199.68.126.110.58068: Flags [P.], seq 18472:18628, ack 1513, win 544, length 156
22:07:14.612602 IP 159.203.38.32.22 > 199.68.126.110.58068: Flags [P.], seq 18628:18768, ack 1513, win 544, length 140
22:07:14.616513 IP 199.68.126.110.58068 > 159.203.38.32.22: Flags [.], ack 18768, win 3567, length 0
22:07:14.716534 IP 159.203.38.32.22 > 199.68.126.110.58068: Flags [P.], seq 18768:19148, ack 1513, win 544, length 380
22:07:14.767146 IP 199.68.126.110.58068 > 159.203.38.32.22: Flags [.], ack 19148, win 3566, length 0
22:07:14.820483 IP 159.203.38.32.22 > 199.68.126.110.58068: Flags [P.], seq 19148:19408, ack 1513, win 544, length 260
22:07:14.876401 IP 199.68.126.110.58068 > 159.203.38.32.22: Flags [.], ack 19408, win 3565, length 0
22:07:14.924460 IP 159.203.38.32.22 > 199.68.126.110.58068: Flags [P.], seq 19408:19668, ack 1513, win 544, length 260
22:07:14.968529 IP 199.68.126.110.58068 > 159.203.38.32.22: Flags [.], ack 19668, win 3570, length 0
22:07:15.028476 IP 159.203.38.32.22 > 199.68.126.110.58068: Flags [P.], seq 19668:19824, ack 1513, win 544, length 156
22:07:15.028604 IP 159.203.38.32.22 > 199.68.126.110.58068: Flags [P.], seq 19824:19964, ack 1513, win 544, length 140
22:07:15.032484 IP 199.68.126.110.58068 > 159.203.38.32.22: Flags [.], ack 19964, win 3569, length 0
22:07:15.132521 IP 159.203.38.32.22 > 199.68.126.110.58068: Flags [P.], seq 19964:20344, ack 1513, win 544, length 380
22:07:15.186934 IP 199.68.126.110.58068 > 159.203.38.32.22: Flags [.], ack 20344, win 3567, length 0
22:07:15.236539 IP 159.203.38.32.22 > 199.68.126.110.58068: Flags [P.], seq 20344:20500, ack 1513, win 544, length 156
22:07:15.236663 IP 159.203.38.32.22 > 199.68.126.110.58068: Flags [P.], seq 20500:20640, ack 1513, win 544, length 140
22:07:15.240507 IP 199.68.126.110.58068 > 159.203.38.32.22: Flags [.], ack 20640, win 3566, length 0
22:07:15.340499 IP 159.203.38.32.22 > 199.68.126.110.58068: Flags [P.], seq 20640:21020, ack 1513, win 544, length 380
22:07:15.390520 IP 199.68.126.110.58068 > 159.203.38.32.22: Flags [.], ack 21020, win 3564, length 0
22:07:15.444468 IP 159.203.38.32.22 > 199.68.126.110.58068: Flags [P.], seq 21020:21176, ack 1513, win 544, length 156
22:07:15.444619 IP 159.203.38.32.22 > 199.68.126.110.58068: Flags [P.], seq 21176:21316, ack 1513, win 544, length 140
22:07:15.447408 IP 199.68.126.110.58068 > 159.203.38.32.22: Flags [.], ack 21316, win 3570, length 0
22:07:15.548536 IP 159.203.38.32.22 > 199.68.126.110.58068: Flags [P.], seq 21316:21696, ack 1513, win 544, length 380
22:07:15.592501 IP 199.68.126.110.58068 > 159.203.38.32.22: Flags [.], ack 21696, win 3568, length 0
22:07:15.652472 IP 159.203.38.32.22 > 199.68.126.110.58068: Flags [P.], seq 21696:21956, ack 1513, win 544, length 260
22:07:15.699570 IP 199.68.126.110.58068 > 159.203.38.32.22: Flags [.], ack 21956, win 3567, length 0
22:07:15.756499 IP 159.203.38.32.22 > 199.68.126.110.58068: Flags [P.], seq 21956:22216, ack 1513, win 544, length 260
22:07:15.809852 IP 199.68.126.110.58068 > 159.203.38.32.22: Flags [.], ack 22216, win 3566, length 0
22:07:15.860469 IP 159.203.38.32.22 > 199.68.126.110.58068: Flags [P.], seq 22216:22372, ack 1513, win 544, length 156
22:07:15.860556 IP 159.203.38.32.22 > 199.68.126.110.58068: Flags [P.], seq 22372:22512, ack 1513, win 544, length 140
22:07:15.864509 IP 199.68.126.110.58068 > 159.203.38.32.22: Flags [.], ack 22512, win 3565, length 0
22:07:15.964520 IP 159.203.38.32.22 > 199.68.126.110.58068: Flags [P.], seq 22512:22892, ack 1513, win 544, length 380
22:07:16.012537 IP 199.68.126.110.58068 > 159.203.38.32.22: Flags [.], ack 22892, win 3570, length 0
22:07:16.068526 IP 159.203.38.32.22 > 199.68.126.110.58068: Flags [P.], seq 22892:23048, ack 1513, win 544, length 156
22:07:16.068637 IP 159.203.38.32.22 > 199.68.126.110.58068: Flags [P.], seq 23048:23188, ack 1513, win 544, length 140
22:07:16.072527 IP 199.68.126.110.58068 > 159.203.38.32.22: Flags [.], ack 23188, win 3569, length 0
22:07:16.172503 IP 159.203.38.32.22 > 199.68.126.110.58068: Flags [P.], seq 23188:23568, ack 1513, win 544, length 380
22:07:16.229005 IP 199.68.126.110.58068 > 159.203.38.32.22: Flags [.], ack 23568, win 3567, length 0
22:07:16.276442 IP 159.203.38.32.22 > 199.68.126.110.58068: Flags [P.], seq 23568:23724, ack 1513, win 544, length 156
22:07:16.276531 IP 159.203.38.32.22 > 199.68.126.110.58068: Flags [P.], seq 23724:23864, ack 1513, win 544, length 140
22:07:16.280563 IP 199.68.126.110.58068 > 159.203.38.32.22: Flags [.], ack 23864, win 3566, length 0
22:07:16.380476 IP 159.203.38.32.22 > 199.68.126.110.58068: Flags [P.], seq 23864:24244, ack 1513, win 544, length 380
22:07:16.432518 IP 199.68.126.110.58068 > 159.203.38.32.22: Flags [.], ack 24244, win 3564, length 0
22:07:16.484426 IP 159.203.38.32.22 > 199.68.126.110.58068: Flags [P.], seq 24244:24400, ack 1513, win 544, length 156
22:07:16.484582 IP 159.203.38.32.22 > 199.68.126.110.58068: Flags [P.], seq 24400:24540, ack 1513, win 544, length 140
22:07:16.488527 IP 199.68.126.110.58068 > 159.203.38.32.22: Flags [.], ack 24540, win 3570, length 0
22:07:16.488585 IP 199.68.126.110.58068 > 159.203.38.32.22: Flags [P.], seq 1513:1549, ack 24540, win 3570, length 36
22:07:16.529243 IP 159.203.38.32.22 > 199.68.126.110.58068: Flags [.], ack 1549, win 544, length 0
22:07:16.588501 IP 159.203.38.32.22 > 199.68.126.110.58068: Flags [P.], seq 24540:25136, ack 1549, win 544, length 596
22:07:16.635516 IP 199.68.126.110.58068 > 159.203.38.32.22: Flags [.], ack 25136, win 3567, length 0
22:07:16.692472 IP 159.203.38.32.22 > 199.68.126.110.58068: Flags [P.], seq 25136:25396, ack 1549, win 544, length 260
22:07:16.744553 IP 199.68.126.110.58068 > 159.203.38.32.22: Flags [.], ack 25396, win 3566, length 0
22:07:16.796464 IP 159.203.38.32.22 > 199.68.126.110.58068: Flags [P.], seq 25396:25656, ack 1549, win 544, length 260
22:07:16.853607 IP 199.68.126.110.58068 > 159.203.38.32.22: Flags [.], ack 25656, win 3565, length 0
22:07:16.900501 IP 159.203.38.32.22 > 199.68.126.110.58068: Flags [P.], seq 25656:25916, ack 1549, win 544, length 260
22:07:16.946357 IP 199.68.126.110.58068 > 159.203.38.32.22: Flags [.], ack 25916, win 3564, length 0
22:07:17.004506 IP 159.203.38.32.22 > 199.68.126.110.58068: Flags [P.], seq 25916:26176, ack 1549, win 544, length 260
22:07:17.054580 IP 199.68.126.110.58068 > 159.203.38.32.22: Flags [.], ack 26176, win 3570, length 0
22:07:17.108528 IP 159.203.38.32.22 > 199.68.126.110.58068: Flags [P.], seq 26176:26436, ack 1549, win 544, length 260
22:07:17.164243 IP 199.68.126.110.58068 > 159.203.38.32.22: Flags [.], ack 26436, win 3569, length 0
22:07:17.212510 IP 159.203.38.32.22 > 199.68.126.110.58068: Flags [P.], seq 26436:26696, ack 1549, win 544, length 260
22:07:17.257681 IP 199.68.126.110.58068 > 159.203.38.32.22: Flags [.], ack 26696, win 3568, length 0
22:07:17.316492 IP 159.203.38.32.22 > 199.68.126.110.58068: Flags [P.], seq 26696:26852, ack 1549, win 544, length 156
22:07:17.316567 IP 159.203.38.32.22 > 199.68.126.110.58068: Flags [P.], seq 26852:26992, ack 1549, win 544, length 140
22:07:17.320538 IP 199.68.126.110.58068 > 159.203.38.32.22: Flags [.], ack 26992, win 3566, length 0
22:07:17.420458 IP 159.203.38.32.22 > 199.68.126.110.58068: Flags [P.], seq 26992:27372, ack 1549, win 544, length 380
22:07:17.475876 IP 199.68.126.110.58068 > 159.203.38.32.22: Flags [.], ack 27372, win 3565, length 0
22:07:17.524480 IP 159.203.38.32.22 > 199.68.126.110.58068: Flags [P.], seq 27372:27632, ack 1549, win 544, length 260
22:07:17.572553 IP 199.68.126.110.58068 > 159.203.38.32.22: Flags [.], ack 27632, win 3564, length 0
22:07:17.628484 IP 159.203.38.32.22 > 199.68.126.110.58068: Flags [P.], seq 27632:27892, ack 1549, win 544, length 260
22:07:17.681527 IP 199.68.126.110.58068 > 159.203.38.32.22: Flags [.], ack 27892, win 3570, length 0
22:07:17.732441 IP 159.203.38.32.22 > 199.68.126.110.58068: Flags [P.], seq 27892:28152, ack 1549, win 544, length 260
22:07:17.790659 IP 199.68.126.110.58068 > 159.203.38.32.22: Flags [.], ack 28152, win 3569, length 0
22:07:17.836504 IP 159.203.38.32.22 > 199.68.126.110.58068: Flags [P.], seq 28152:28308, ack 1549, win 544, length 156
22:07:17.836620 IP 159.203.38.32.22 > 199.68.126.110.58068: Flags [P.], seq 28308:28448, ack 1549, win 544, length 140
22:07:17.839293 IP 199.68.126.110.58068 > 159.203.38.32.22: Flags [.], ack 28448, win 3567, length 0
22:07:17.940471 IP 159.203.38.32.22 > 199.68.126.110.58068: Flags [P.], seq 28448:28604, ack 1549, win 544, length 156
22:07:17.940591 IP 159.203.38.32.22 > 199.68.126.110.58068: Flags [P.], seq 28604:28864, ack 1549, win 544, length 260
22:07:17.943247 IP 199.68.126.110.58068 > 159.203.38.32.22: Flags [.], ack 28864, win 3566, length 0
^C
218 packets captured
222 packets received by filter
0 packets dropped by kernel
root@lamp-ubuntu-s-1vcpu-1gb-tor1-01:~#
